name,category,scientific_name,description,image_url,source_url,extra
Allium,poisonous,,"Allium is a large genus of monocotyledonous flowering plants with 1112 accepted species, making Allium the largest genus in the family Amaryllidaceae and among the largest plant genera in the world. Many of the species are edible, and some have a long history of cultivation and human consumption such as the onion, garlic, scallions, shallots, leeks, and chives. Allium species occur in temperate climates of the Northern Hemisphere, except for a few species occurring in Chile (such as A. juncifolium), Brazil (A. sellovianum), and tropical Africa (A. spathaceum). They vary in height between 5–150 centimetres (2–59 in). The flowers form an umbel at the top of a leafless stalk. The bulbs vary in size between species, from small (around 2–3 mm in diameter) to rather large (8–10 cm). Some species (such as Welsh onion A. fistulosum and leeks (A. ampeloprasum)) develop thickened leaf-bases rather than forming bulbs as such. Carl Linnaeus first described the genus Allium in 1753. The generic name Allium is the Latin word for garlic, and the type species for the genus is Allium sativum which means ""cultivated garlic"". The decision to include a species in the genus Allium is taxonomically difficult, and species boundaries are unclear. Estimates of the number of species are as low as 260, and as high as 979. In the APG III classification system, Allium is placed in the family Amaryllidaceae, subfamily Allioideae (formerly the family Alliaceae). In some of the older classification systems, Allium was placed in Liliaceae. Molecular phylogenetic studies have shown this circumscription of Liliaceae is not monophyletic. Various Allium species have been cultivated from the earliest times. About a dozen species are economically important as crops, or garden vegetables, and an increasing number of species are important as ornamental plants. Plants belonging to this genus produce cysteine-derived organosulfur compounds, which impart a distinctive onion or garlic flavor and scent. Many are used as food plants, though not all members of the genus are equally flavorful. In most cases, both bulb and leaves are edible. The characteristic Allium flavor depends on the sulfate content of the soil the plant grows in. In the rare occurrence of sulfur-depleted growth conditions, all Allium species completely lose their usual odors and flavors.",https://upload.wikimedia.org/wikipedia/commons/thumb/c/c9/Ursa_ajlo_1.jpg/960px-Ursa_ajlo_1.jpg,https://en.wikipedia.org/wiki/Allium,"{""wikipedia_title"": ""Allium"", ""image_full"": ""https://upload.wikimedia.org/wikipedia/commons/c/c9/Ursa_ajlo_1.jpg""}"
onion,poisonous,,,https://upload.wikimedia.org/wikipedia/commons/thumb/a/a2/Mixed_onions.jpg/960px-Mixed_onions.jpg,https://en.wikipedia.org/wiki/Onion,"{""wikipedia_title"": ""Onion"", ""image_full"": ""https://upload.wikimedia.org/wikipedia/commons/a/a2/Mixed_onions.jpg""}"
garlic,poisonous,,"Garlic (Allium sativum) is a species of bulbous flowering plants in the genus Allium. Its close relatives include the onion, shallot, leek, chives, Welsh onion, and Chinese onion. Garlic is native to central and western Asia, stretching from the Black Sea through the southern Caucasus, northeastern Iran, and the Hindu Kush. It has naturalized in many other parts of the world, including Mediterranean Europe and China. There are two subspecies and hundreds of varieties of garlic. Garlic has been used for thousands of years as a seasoning, culinary ingredient, and traditional medical remedy. It was known in many ancient civilizations, including the Babylonians, Egyptians, Jews, Romans, and Chinese, and remains significant in many cuisines and folk treatments, especially across the Mediterranean and Asia. Sulfur compounds give garlic its pungent odor and flavor. There is insufficient clinical evidence to indicate that consuming garlic has any health benefits. Garlic is cultivated in a variety of climates and countries; China was the largest producer in 2024, accounting for 73% of the world's supply, according to the United Nations FAOSTAT.",https://upload.wikimedia.org/wikipedia/commons/3/39/Allium_sativum_Woodwill_1793.jpg,https://en.wikipedia.org/wiki/Garlic,"{""wikipedia_title"": ""Garlic""}"
leek,poisonous,,"A leek is a biennial vegetable, a cultivar of Allium ampeloprasum, the broadleaf wild leek (syn. Allium porrum). The edible part of the plant is a bundle of leaf sheaths that is sometimes colloquially called a ""stem"" or ""stalk"". The genus Allium also contains the onion, garlic, shallot, scallion, chives, and Chinese onion. Three closely related vegetables—elephant garlic, kurrat and Persian leek or tareh—are also cultivars of A. ampeloprasum, although different in their culinary uses.",https://upload.wikimedia.org/wikipedia/commons/thumb/6/63/Leek_on_white_background_-_0947.jpg/960px-Leek_on_white_background_-_0947.jpg,https://en.wikipedia.org/wiki/Leek,"{""wikipedia_title"": ""Leek"", ""image_full"": ""https://upload.wikimedia.org/wikipedia/commons/6/63/Leek_on_white_background_-_0947.jpg""}"
chive,poisonous,,,https://upload.wikimedia.org/wikipedia/commons/thumb/4/49/Allium_schoenoprasum_-_Bombus_lapidarius_-_Tootsi.jpg/960px-Allium_schoenoprasum_-_Bombus_lapidarius_-_Tootsi.jpg,https://en.wikipedia.org/wiki/Chive,"{""wikipedia_title"": ""Chives"", ""image_full"": ""https://upload.wikimedia.org/wikipedia/commons/4/49/Allium_schoenoprasum_-_Bombus_lapidarius_-_Tootsi.jpg""}"
Amaryllidaceae,poisonous,,"The Amaryllidaceae are a family of herbaceous, mainly perennial and bulbous (rarely rhizomatous) flowering plants in the monocot order Asparagales. The family takes its name from the genus Amaryllis and is commonly known as the amaryllis family. The leaves are usually linear, and the flowers are usually bisexual and symmetrical, arranged in umbels on the stem. The petals and sepals are undifferentiated as tepals, which may be fused at the base into a floral tube. Some also display a corona. Allyl sulfide compounds produce the characteristic odour of the onion subfamily (Allioideae). The family, which was originally created in 1805, now contains about 1600 species, divided into 71 genera, 17 tribes and three subfamilies, the Agapanthoideae (Agapanthus), Allioideae (onions, garlic and chives) and Amaryllidoideae (amaryllis, daffodils, snowdrops). Over time, it has seen much reorganisation and at various times was combined with the related Liliaceae. Since 2009, a very broad view has prevailed based on phylogenetics, and including a number of other former families. The family is found in tropical to subtropical and temperate areas of the world and includes many ornamental garden plants and vegetables.",https://upload.wikimedia.org/wikipedia/commons/thumb/7/70/Amaryllis_belladonna_sfbg_2.jpg/960px-Amaryllis_belladonna_sfbg_2.jpg,https://en.wikipedia.org/wiki/Amaryllidaceae,"{""wikipedia_title"": ""Amaryllidaceae"", ""image_full"": ""https://upload.wikimedia.org/wikipedia/commons/7/70/Amaryllis_belladonna_sfbg_2.jpg""}"
thiosulphate,poisonous,,,https://upload.wikimedia.org/wikipedia/commons/thumb/e/e7/Thiosulfate-ion-2D-dimensions.png/960px-Thiosulfate-ion-2D-dimensions.png,https://en.wikipedia.org/wiki/Thiosulphate,"{""wikipedia_title"": ""Thiosulfate"", ""image_full"": ""https://upload.wikimedia.org/wikipedia/commons/e/e7/Thiosulfate-ion-2D-dimensions.png""}"
Asparagus,poisonous,,"Asparagus (Asparagus officinalis) or garden asparagus is a perennial flowering plant species in the genus Asparagus native to Eurasia. Widely cultivated as a vegetable crop, its young shoots are used as a spring vegetable.",,https://en.wikipedia.org/wiki/Asparagus,"{""wikipedia_title"": ""Asparagus""}"
Asparagaceae,poisonous,,"Asparagaceae (), known as the asparagus family, is a family of flowering plants, placed in the order Asparagales of the monocots. The family name is based on the edible garden asparagus, Asparagus officinalis. This family includes both common garden plants as well as common houseplants. The garden plants include asparagus, yucca, bluebell, lily of the valley, and hosta, and the houseplants include snake plant, corn cane, spider plant, and plumosus fern. The Asparagaceae is a morphologically heterogenous family with the included species varying widely in their appearance and growth form. It has a cosmopolitan distribution, with genera and species contained in the family native to all continents except Antarctica.",https://upload.wikimedia.org/wikipedia/commons/thumb/9/90/Asperge_in_bloei_Asparagus_officinalis.jpg/960px-Asperge_in_bloei_Asparagus_officinalis.jpg,https://en.wikipedia.org/wiki/Asparagaceae,"{""wikipedia_title"": ""Asparagaceae"", ""image_full"": ""https://upload.wikimedia.org/wikipedia/commons/9/90/Asperge_in_bloei_Asparagus_officinalis.jpg""}"
Asparagus officinalis,poisonous,,"Asparagus (Asparagus officinalis) or garden asparagus is a perennial flowering plant species in the genus Asparagus native to Eurasia. Widely cultivated as a vegetable crop, its young shoots are used as a spring vegetable.",,https://en.wikipedia.org/wiki/Asparagus_officinalis,"{""wikipedia_title"": ""Asparagus""}"
Asparagus densiflorus,poisonous,,"Asparagus densiflorus (among several species colloquially called asparagus ferns; no relation to actual ferns), or the foxtail fern (asparagus) or plume fern, is a variable, evergreen-perennial plant related to cultivated, edible asparagus. It is native to southern Africa, from Mozambique to South Africa, but is widely cultivated.",https://upload.wikimedia.org/wikipedia/commons/thumb/0/02/Asparagus_densiflorus_%27Myersii%27.jpg/960px-Asparagus_densiflorus_%27Myersii%27.jpg,https://en.wikipedia.org/wiki/Asparagus_densiflorus,"{""wikipedia_title"": ""Asparagus densiflorus"", ""image_full"": ""https://upload.wikimedia.org/wikipedia/commons/0/02/Asparagus_densiflorus_%27Myersii%27.jpg""}"
saponins,poisonous,,,,https://en.wikipedia.org/wiki/Saponin,"{""wikipedia_title"": ""Saponin""}"
Blighia sapida,poisonous,,"The ackee (Blighia sapida), also known as acki, akee, or ackee apple, is a fruit of the Sapindaceae (soapberry) family, as are the lychee and the longan. It is native to tropical West Africa. The scientific name honours Captain William Bligh who took the fruit from Jamaica to the Royal Botanic Gardens in Kew, England, in 1793. The English common name is derived from the West African Akan-language name akye fufo. Although having a long-held reputation as being poisonous with potential fatalities, the fruit arils are renowned as delicious when ripe, prepared properly, and cooked and are a feature of various Caribbean cuisines. Ackee is the national fruit of Jamaica and is considered a delicacy.",https://upload.wikimedia.org/wikipedia/commons/thumb/c/cf/Ackee_001.jpg/960px-Ackee_001.jpg,https://en.wikipedia.org/wiki/Blighia_sapida,"{""wikipedia_title"": ""Ackee"", ""image_full"": ""https://upload.wikimedia.org/wikipedia/commons/c/cf/Ackee_001.jpg""}"
ackee,poisonous,,"The ackee (Blighia sapida), also known as acki, akee, or ackee apple, is a fruit of the Sapindaceae (soapberry) family, as are the lychee and the longan. It is native to tropical West Africa. The scientific name honours Captain William Bligh who took the fruit from Jamaica to the Royal Botanic Gardens in Kew, England, in 1793. The English common name is derived from the West African Akan-language name akye fufo. Although having a long-held reputation as being poisonous with potential fatalities, the fruit arils are renowned as delicious when ripe, prepared properly, and cooked and are a feature of various Caribbean cuisines. Ackee is the national fruit of Jamaica and is considered a delicacy.",https://upload.wikimedia.org/wikipedia/commons/thumb/c/cf/Ackee_001.jpg/960px-Ackee_001.jpg,https://en.wikipedia.org/wiki/Ackee,"{""wikipedia_title"": ""Ackee"", ""image_full"": ""https://upload.wikimedia.org/wikipedia/commons/c/cf/Ackee_001.jpg""}"
Sapindaceae,poisonous,,,https://upload.wikimedia.org/wikipedia/commons/thumb/a/a5/Lychee.jpg/960px-Lychee.jpg,https://en.wikipedia.org/wiki/Sapindaceae,"{""wikipedia_title"": ""Sapindaceae"", ""image_full"": ""https://upload.wikimedia.org/wikipedia/commons/a/a5/Lychee.jpg""}"
hypoglycin A,poisonous,,"Hypoglycin A is a naturally occurring amino acid derivative found in the unripened fruit of the ackee tree (Blighia sapida) and in the seeds of the box elder tree (Acer negundo). It is toxic if ingested, and is the causative agent of Jamaican vomiting sickness. A 2017 Lancet report established a link between the consumption of unripened lychees (which contain hypoglycin A or the related chemical compound methylenecyclopropylglycine (MCPG)) resulting in hypoglycaemia and death from acute toxic encephalopathy.",https://upload.wikimedia.org/wikipedia/commons/thumb/3/34/Hypoglycin_A.svg/960px-Hypoglycin_A.svg.png,https://en.wikipedia.org/wiki/Hypoglycin_A,"{""wikipedia_title"": ""Hypoglycin A"", ""image_full"": ""https://upload.wikimedia.org/wikipedia/commons/3/34/Hypoglycin_A.svg""}"
hypoglycin B,poisonous,,Hypoglycin B is a naturally occurring organic compound in the species Blighia sapida. It is particularly concentrated in the fruit of the plant especially in the seeds. Hypoglycin B is toxic if ingested and is one of the causative agents of Jamaican vomiting sickness. It is a dipeptide of glutamic acid and hypoglycin A.,https://upload.wikimedia.org/wikipedia/commons/thumb/b/b6/Hypoglycin_B.svg/960px-Hypoglycin_B.svg.png,https://en.wikipedia.org/wiki/Hypoglycin_B,"{""wikipedia_title"": ""Hypoglycin B"", ""image_full"": ""https://upload.wikimedia.org/wikipedia/commons/b/b6/Hypoglycin_B.svg""}"
fatty acid metabolism,poisonous,,"Fatty acid metabolism consists of various metabolic processes involving or closely related to fatty acids, a family of molecules classified within the lipid macronutrient category. These processes can mainly be divided into (1) catabolic processes that generate energy and (2) anabolic processes where they serve as building blocks for other compounds. In catabolism, fatty acids are metabolized to produce energy, mainly in the form of adenosine triphosphate (ATP). When compared to other macronutrient classes (carbohydrates and protein), fatty acids yield the most ATP on an energy per gram basis, when they are completely oxidized to CO2 and water by beta oxidation and the citric acid cycle. Fatty acids (mainly in the form of triglycerides) are therefore the foremost storage form of fuel in most animals, and to a lesser extent in plants. In anabolism, intact fatty acids are important precursors to triglycerides, phospholipids, second messengers, hormones and ketone bodies. For example, phospholipids form the phospholipid bilayers out of which all the membranes of the cell are constructed from fatty acids. Phospholipids comprise the plasma membrane and other membranes that enclose all the organelles within the cells, such as the nucleus, the mitochondria, endoplasmic reticulum, and the Golgi apparatus. In another type of anabolism, fatty acids are modified to form other compounds such as second messengers and local hormones. The prostaglandins made from arachidonic acid stored in the cell membrane are probably the best-known of these local hormones.",,https://en.wikipedia.org/wiki/Fatty_acid_metabolism,"{""wikipedia_title"": ""Fatty acid metabolism""}"
hypoglycemia,poisonous,,"Hypoglycemia (American English), also spelled hypoglycaemia or hypoglycæmia (British English), sometimes called low blood sugar, is a fall in blood sugar to levels below normal, typically below 70 mg/dL (3.9 mmol/L). Whipple's triad is used to properly identify hypoglycemic episodes. It is defined as blood glucose below 70 mg/dL (3.9 mmol/L), symptoms associated with hypoglycemia, and resolution of symptoms when blood sugar returns to normal. Hypoglycemia may result in headache, tiredness, clumsiness, trouble talking, confusion, fast heart rate, sweating, shakiness, nervousness, hunger, loss of consciousness, seizures, or death. Symptoms typically come on quickly. Symptoms can persist after blood-glucose levels are restored to normal. The most common cause of hypoglycemia is medications used to treat diabetes such as insulin, sulfonylureas, and biguanides. Risk is greater in diabetics who have eaten less than usual, recently exercised, or consumed alcohol. Other causes of hypoglycemia include severe illness, sepsis, kidney failure, liver disease, hormone deficiency, tumors such as insulinomas or non-B cell tumors, inborn errors of metabolism, and several medications. Low blood sugar may occur in otherwise healthy newborns who have not eaten for a few hours. Hypoglycemia is treated by eating a sugary food or drink, for example glucose tablets or gel, apple juice, soft drink, or lollipops. The person must be conscious and able to swallow. The goal is to consume 10–20 grams of a carbohydrate to raise blood glucose levels to a minimum of 70 mg/dL (3.9 mmol/L). If a person is not able to take food by mouth, glucagon by injection or insufflation may help. The treatment of hypoglycemia unrelated to diabetes includes treating the underlying problem. Among people with diabetes, prevention starts with learning the signs and symptoms of hypoglycemia. Diabetes medications, like insulin, sulfonylureas, and biguanides can also be adjusted or stopped to prevent hypoglycemia. Frequent and routine blood glucose testing is recommended. Some may find continuous glucose monitors with insulin pumps to be helpful in the management of diabetes and prevention of hypoglycemia.",https://upload.wikimedia.org/wikipedia/commons/thumb/e/ea/Hypoglycemia.jpg/960px-Hypoglycemia.jpg,https://en.wikipedia.org/wiki/Hypoglycemia,"{""wikipedia_title"": ""Hypoglycemia"", ""image_full"": ""https://upload.wikimedia.org/wikipedia/commons/e/ea/Hypoglycemia.jpg""}"
Citrus,poisonous,,"Citrus is a genus of flowering trees and shrubs in the family Rutaceae. Plants in the genus produce citrus fruits, such as citrons, mandarins, and pomelos. Many important citrus crops have been developed through extensive hybridization, including oranges, lemons, grapefruits, and limes, all of which have many cultivars. Citrus is native to South Asia, East Asia, Southeast Asia, Melanesia, and Australia. Indigenous people in these areas have used and domesticated various species since ancient times. Its cultivation first spread into Micronesia and Polynesia through the Austronesian expansion (c. 3000–1500 BCE). Later, it was spread to the Middle East and the Mediterranean (c. 1200 BCE) via the incense trade route, and then from Europe to the Americas. Renowned for their highly fragrant aromas and complex flavor, citrus are among the most popular fruits in cultivation. With a propensity to hybridize between species, making their taxonomy complicated, the genus has numerous varieties encompassing a wide range of appearance and fruit flavors.",https://upload.wikimedia.org/wikipedia/commons/b/b0/OrangeBloss_wb.jpg,https://en.wikipedia.org/wiki/Citrus,"{""wikipedia_title"": ""Citrus""}"
lemon,poisonous,,"The lemon (Citrus × limon) is a species of small evergreen tree in the Citrus genus of the flowering plant family Rutaceae. A true lemon is a hybrid of the citron and the bitter orange. Its origins are uncertain, but some evidence suggests lemons originated during the 1st millennium BC in what is now northeastern India. Some other citrus fruits are called lemon. The yellow fruit of the lemon tree is used throughout the world, primarily for its juice. The pulp and rind are used in cooking and baking. The juice of the lemon is about 5–6% citric acid, giving it a sour taste. This makes it a key ingredient in drinks and foods such as lemonade and lemon meringue pie. In 2024, world production was 23 million tonnes, led by India and Mexico with 31% of the total.",https://upload.wikimedia.org/wikipedia/commons/thumb/e/e4/P1030323.JPG/960px-P1030323.JPG,https://en.wikipedia.org/wiki/Lemon,"{""wikipedia_title"": ""Lemon"", ""image_full"": ""https://upload.wikimedia.org/wikipedia/commons/e/e4/P1030323.JPG""}"
lime,poisonous,,,https://upload.wikimedia.org/wikipedia/commons/thumb/8/8b/Lime_Blossom.jpg/960px-Lime_Blossom.jpg,https://en.wikipedia.org/wiki/Lime_(fruit),"{""wikipedia_title"": ""Lime (fruit)"", ""image_full"": ""https://upload.wikimedia.org/wikipedia/commons/8/8b/Lime_Blossom.jpg""}"
grapefruit,poisonous,,"The grapefruit (Citrus × paradisi) is a subtropical citrus tree known for its relatively large, sour to semi-sweet, somewhat bitter fruit. The flesh of the fruit is segmented and varies in color from pale yellow to dark red. Grapefruits originated in Barbados in the 18th century. They are a citrus hybrid that was created through an accidental cross between the sweet orange (C. × sinensis) and the pomelo (C. maxima), both of which were introduced to the Caribbean from Asia in the 17th century. It has also been called the 'forbidden fruit'. In the past it was called the pomelo, but that term is now mostly used as the common name for Citrus maxima. Grapefruit–drug interactions are common, as the juice contains furanocoumarins that interfere with the metabolism of many drugs. This can prolong and intensify the effects of those drugs, leading to multiple side-effects such as abnormal heart rhythms, bleeding inside the stomach, low blood pressure, difficulty breathing, and dizziness.",https://upload.wikimedia.org/wikipedia/commons/thumb/8/8c/Grapefruits_-_whole-halved-segments.jpg/960px-Grapefruits_-_whole-halved-segments.jpg,https://en.wikipedia.org/wiki/Grapefruit,"{""wikipedia_title"": ""Grapefruit"", ""image_full"": ""https://upload.wikimedia.org/wikipedia/commons/8/8c/Grapefruits_-_whole-halved-segments.jpg""}"
orange,poisonous,,,https://upload.wikimedia.org/wikipedia/commons/thumb/e/e3/Oranges_-_whole-halved-segment.jpg/960px-Oranges_-_whole-halved-segment.jpg,https://en.wikipedia.org/wiki/Orange_(fruit),"{""wikipedia_title"": ""Orange (fruit)"", ""image_full"": ""https://upload.wikimedia.org/wikipedia/commons/e/e3/Oranges_-_whole-halved-segment.jpg""}"
Rutaceae,poisonous,,,https://upload.wikimedia.org/wikipedia/commons/b/b4/Skimmia_reevesiana2.jpg,https://en.wikipedia.org/wiki/Rutaceae,"{""wikipedia_title"": ""Rutaceae""}"
citrus fruits,poisonous,,"Citrus is a genus of flowering trees and shrubs in the family Rutaceae. Plants in the genus produce citrus fruits, such as citrons, mandarins, and pomelos. Many important citrus crops have been developed through extensive hybridization, including oranges, lemons, grapefruits, and limes, all of which have many cultivars. Citrus is native to South Asia, East Asia, Southeast Asia, Melanesia, and Australia. Indigenous people in these areas have used and domesticated various species since ancient times. Its cultivation first spread into Micronesia and Polynesia through the Austronesian expansion (c. 3000–1500 BCE). Later, it was spread to the Middle East and the Mediterranean (c. 1200 BCE) via the incense trade route, and then from Europe to the Americas. Renowned for their highly fragrant aromas and complex flavor, citrus are among the most popular fruits in cultivation. With a propensity to hybridize between species, making their taxonomy complicated, the genus has numerous varieties encompassing a wide range of appearance and fruit flavors.",https://upload.wikimedia.org/wikipedia/commons/b/b0/OrangeBloss_wb.jpg,https://en.wikipedia.org/wiki/Citrus_fruit,"{""wikipedia_title"": ""Citrus""}"
limonene,poisonous,,,https://upload.wikimedia.org/wikipedia/commons/thumb/c/cb/Limonene.jpg/960px-Limonene.jpg,https://en.wikipedia.org/wiki/Limonene,"{""wikipedia_title"": ""Limonene"", ""image_full"": ""https://upload.wikimedia.org/wikipedia/commons/c/cb/Limonene.jpg""}"
linalool,poisonous,,,https://upload.wikimedia.org/wikipedia/commons/thumb/3/36/%28S%29-Linalool_molecule_ball.png/960px-%28S%29-Linalool_molecule_ball.png,https://en.wikipedia.org/wiki/Linalool,"{""wikipedia_title"": ""Linalool"", ""image_full"": ""https://upload.wikimedia.org/wikipedia/commons/3/36/%28S%29-Linalool_molecule_ball.png""}"
psoralen,poisonous,,,https://upload.wikimedia.org/wikipedia/commons/thumb/a/ac/Psoralen.svg/960px-Psoralen.svg.png,https://en.wikipedia.org/wiki/Psoralen,"{""wikipedia_title"": ""Psoralen"", ""image_full"": ""https://upload.wikimedia.org/wikipedia/commons/a/ac/Psoralen.svg""}"
photosensitivity,poisonous,,,,https://en.wikipedia.org/wiki/Photosensitivity,"{""wikipedia_title"": ""Photosensitivity""}"
Lathyrus sativus,poisonous,,"Lathyrus sativus, also known as grass pea, cicerchia, blue sweet pea, chickling pea, chickling vetch, Indian pea, white pea and white vetch, is a legume (family Fabaceae) commonly grown for human consumption and livestock feed in Asia and East Africa. It is a particularly important crop in areas that are prone to drought and famine, and is thought of as an 'insurance crop' as it produces reliable yields when all other crops fail. The seeds contain a neurotoxin that causes lathyrism, a neurodegenerative disease, if eaten as a primary protein source for a prolonged period.",https://upload.wikimedia.org/wikipedia/commons/a/ae/Lathyrus_sativus_flowers_Bangladesh_cropped.JPG,https://en.wikipedia.org/wiki/Lathyrus_sativus,"{""wikipedia_title"": ""Lathyrus sativus""}"
